#,project_date,project_ref#,investing_company,parent_company,company_profile,website,revenue_(usd_m),headcount,r&d_expenditure_(usd_m),year_established,company_email,company_telephone,source_region,source_country,source_state,source_admin_region_(us_county),source_city,destination_region,destination_country,destination_state,destination_admin_region_(us_county),destination_city,free_zone,relocation,sector,sub_sector,cluster,activity,jobs_created,estimated,capital_investment,estimated.1,project_type,project_status,motive_description,markets_served,joint_venture_companies,source,source_is_th,destination_is_th,source_questionable,developed,emne,bordering_country,industry,natural_resource_ind,colonial_link,year
2,2018-12-01,#320624,WaystoCap,WaystoCap,"WaystoCap is a B2B marketplace where businesses in Africa can buy and sell products. WaystoCap facilitates the whole trading operation so that its buyers can find the most competitive products and obtain financing. The company was established in 2014 and is headquartered in Casablanca, Morocco.",www.waystocap.com/,,,,2014.0,info@waystocap.com,+212522486487,Africa,morocco,Casablanca-Settat,Not Specified,Casablanca,Africa,burkina_faso,Centre,Not Specified,Ouagadougou,,,Software & IT services,Internet publishing & broadcasting & web search,Consumer Goods,"Sales, Marketing & Support",19,Yes,5.2,Yes,New,Opened,,,,https://www.menabytes.com/waystocap-logistics-local-sales/,False,False,False,False,True,False,software_and_it_services_internet_publishing_and_broadcasting_and_web_search_sales_marketing_and_support,False,False,2018
25,2018-11-01,#341493,Red Star Express,Red Star Express,"Nigeria-based Red Star Express is a company that provides courier services, mailroom management services, freight services, logistics, warehousing and general haulage. The company operates through four segments: courier, freight, logistics, and support services. The company was founded in 1992 and is based in Lagos, Nigeria.",redstarplc.com/,,,,1992.0,enquiries@redstarplc.com,+2349062071819,Africa,nigeria,Lagos State,Not Specified,Lagos,Africa,burkina_faso,Not Specified,Not Specified,Not Specified,,,Transportation & Warehousing,Freight/Distribution Services,Transportation & Warehousing,"Sales, Marketing & Support",22,Yes,8.2,Yes,New,Opened,,,,https://redstarplc.com/red-star-now-open-burkina-faso/,False,False,False,False,True,False,transportation_and_warehousing_freightdistribution_services_sales_marketing_and_support,False,False,2018
100,2018-08-01,#352710,BIA Burkina,BIA Group,"BIA Group provides advice and support for clients in their mining, quarrying, forestry, public works and transport projects. BIA Group offers a range of equipment and accessories from manufacturers such as Komatsu, Sandvik, Bomag, Foton and Cummins. The company is based in Ebene, Mauritius.",www.biagroup.com/afr-en/,,,,,,,Africa,mauritius,Mauritius,Not Specified,Ebene,Africa,burkina_faso,Hauts-Bassins,Not Specified,Bobo-Dioulasso,,,Industrial equipment,"Agriculture, construction, & mining machinery",Industrial,"Sales, Marketing & Support",12,Yes,2.9,Yes,New,Opened,,,,https://www.biagroup.com/afr-en/news/bia-burkina-inaugurates-its-new-headquarters-in-ouagadougou/,True,False,True,False,True,False,industrial_equipment_agriculture_construction_and_mining_machinery_sales_marketing_and_support,False,False,2018
123,2018-08-01,#312646,VoxAfrica,VoxAfrica,"Voxafrica is a bi-lingual, news and general entertainment channel offering programmes and interactive services on cable, satellite, internet, IPTV and also available in hotels throughout Africa. The company was founded in 2007 and is headquartered in London, UK.",voxafrica.com,,,,2007.0,sales@voxafrica.com,+445603863913,Western Europe,united_kingdom,South East (UK),Greater London,London,Africa,burkina_faso,Centre,Not Specified,Ouagadougou,,,Communications,Radio & TV broadcasting,Creative Industries,"Sales, Marketing & Support",37,Yes,4.7,Yes,New,Opened,,,,https://www.agenceecofin.com/operateur/2808-59453-burkina-faso-la-chaine-de-television-voxafrica-lance-les-activites-de-ses-bureaux-de-ouagadougou?utm_source=newsletter_6918&utm_medium=email&utm_campaign=ecofin-comm-28-08-2018,False,False,False,True,False,False,communications_radio_and_tv_broadcasting_sales_marketing_and_support,False,False,2018
292,2018-02-01,#296311,Ayka Textile,Ayka Textile,"Ayka Textile is a vertically integrated textile manufacturer, covering spinning, knitting, dyeing and sewing facilities in Istanbul, Turkey. Ayka Textile was founded in 1988 as a ready-made garment manufacturer and exporter.",www.aykatextile.com,,,,1988.0,service@aykatextile.com,+902126566100,Emerging Europe,turkey,Turkey,Istanbul,Istanbul,Africa,burkina_faso,Not Specified,Not Specified,Not Specified,,,Textiles,Textiles & Textile Mills,"Wood, Apparel & Related Products",Manufacturing,3000,Yes,378.0,No,New,Announced,,,,https://www.journalducameroun.com/en/bfaso-turkish-company-to-open-cfaf200b-cotton-plant/,False,False,False,False,True,False,textiles_textiles_and_textile_mills_manufacturing,False,False,2018
298,2018-02-01,#299179,Cimburkina,HeidelbergCement,"HeidelbergCement engages in the production and distribution of cement and aggregates worldwide. The company also offers ready-mixed concrete, concrete products, and concrete elements, as well as other related products and services. HeidelbergCement was founded in 1873 and is based in Heidelberg, Germany.",www.heidelbergcement.com,19291.01,0.0,127.37,1873.0,,+22625355050,Western Europe,germany,Baden-Wurttemberg,Karlsruhe,Heidelberg,Africa,burkina_faso,Centre,Not Specified,Ouagadougou,,,Building materials,Cement & concrete products,Construction,Manufacturing,65,Yes,28.1642,No,Expansion,Announced,,,,http://www.sidwaya.bf/m-19993-cimburkina-sa-un-nouveau-broyeur-pour-doubler-la-production-dans-11-mois.html,False,False,False,True,False,False,building_materials_cement_and_concrete_products_manufacturing,False,False,2018
316,2018-02-01,#298534,Groupe Banque Atlantique (Atlantic Bank Group),Banque Centrale Populaire,"Banque Centrale Populaire provides banking products and services in Morocco, Africa, Europe, and internationally. The company accepts current accounts, cheque accounts, factoring accounts, savings accounts, term accounts, bank deposits, and other deposit accounts, as well as offers various loans. It also provides financing, investment banking, and asset management services. The company operates 1326 branches; 641 distribution points; and 1609 ATMs in Morocco. Banque Centrale Populaire was founded in 1926 and is based in Casablanca, Morocco.",www.gbp.ma,1148.609,0.0,,1926.0,info@banqueatlantique.net,+2251000603,Africa,morocco,Casablanca-Settat,Not Specified,Casablanca,Africa,burkina_faso,Boulgou,Not Specified,Tenkodogo,,,Financial services,Retail banking,Financial Services,Business Services,22,Yes,9.5,Yes,New,Opened,,,,https://www.banqueatlantique.net/ouagadougou-banque-atlantique-se-rapproche-de-sa-clientele-avec-une-nouvelle-agence-moderne-a-tenkodogo/,False,False,False,False,True,False,financial_services_retail_banking_business_services,False,False,2018
